codigo,especificacao_da_receita,receita_orcada,realizada_no_mes,pct_realizada_mes_sobre_o_orcado,realizada_ate_o_mes,pct_ate_o_mes_sobre_o_orcado
17619910,Programa de Modernização do Sistema de Controle Externo dos Estados e Municípios Brasileiros - Promoex/MP/BID,628500,0,0,0,0
17619911,Convênio Secretaria Nacional de Segurança Pública - SENASP n°006/03,0,0,0,0,0
17619912,Convênio Secretaria Nacional de Segurança Pública - SENASP,5255000,0,0,0,0
17619913,PMSPISDTS - Plansine - FAT,0,1577625,0,1577625,0
17619914,Convênio PMSP/SDTS - PIanTeQ/2004 - FAT,0,0,0,0,0
17619915,Convênios MINC/SMC,0,0,0,0,0
17620000,TRANSFERÉNCIA DE CONVÊNIOS DOS ESTADOS E DO DISTRITO FEDERAL E DE SUAS ENTIDADES,32838900,1779502.83,5.42,2561975.98,7.8
17620100,TRANSFERÊNCIAS DE CONVÊNIO DOS ESTADOS P/O SISTEMA ÚNICO DE SAÚDE - SUS,22800000,1779502.83,7.8,1779502.83,7.8
17620101,Convênio Programa de Assistência Farmacêutica Básica do Estado de São Paulo - Dose Certa,22800000,1779502.83,7.8,1779502.83,7.8
17629008,Programa Socioeducativo em Meio Aberto - Espaço Amigo -SAS,0,0,0,0,0
17629900,OUTRAS TRANSFERENCIAS DE CONVÉNIO DOS ESTADOS,10038900,0,0,782473.15,7.79
17629901,Programa Revisão do Benefício de Prestação Continuada - BPC,270000,0,0,0,0
17629902,Programa Estação Cidadania,0,0,0,0,0
17629903,Projeto Criando Asas - Resolução SEADS 10 de 07105/02,0,0,0,0,0
17629904,Programa Fortalecendo a Família - Resolução SEADS 11 de 08/05/02,0,0,0,0,0
17629905,Programa de Atendimento ao Idoso,0,0,0,0,0
17629906,Programa Acolher/Atendimento ao Migrante,0,0,0,0,0
17629907,Programa Ação de Inclusão Social e Proteção Especial - SAS,0,0,0,0,0
17629909,Programa PPD - Segmento Pessoa com Deficiência - SAS,0,0,0,0,0
17629910,Proteção Social Básica/FMAS,6627900,0,0,575952.15,8.69
17629911,Proteção Social EspeciaI-FMAS,3141000,0,0,206521,6.58
17640000,TRANSFERÊNCIA DE CONVÊNIOS DE INSTITUIÇÕES PRIVADAS,0,0,0,0,0
19000000,OUTRAS RECEITAS CORRENTES,1204239000,61930790.76,5.14,136265499.54,11.32
19100000,MULTAS E JUROS DE MORA,566436100,29149711.38,5.15,69394772.52,12.25
19110000,MULTAS E JUROS DE MORA DOS TRIBUTOS,74924000,4182242.64,5.58,8636399.48,11.53
19110200,MULTAS E JUROS DE MORA - IMPOSTO DE RENDA E PROVENTOS DE QUALQUER NATUREZA,14500,276.16,1.9,380.19,2.62
19110203,Multas e Juros de Mora do Impostos/a Renda Retido nas Fontes,14500,276.16,1.9,380.19,2.62
19113800,MULTAS E JUROS DE MORA DO IMPOSTOS/A PROPRIEDADE PREDIAL E TERRITORIAL URBANA - IPTU,27012200,1466477.1,5.43,3615988.43,13.39
19113900,MULTAS E JUROS DE MORA DO IMPOSTO S/A TRANSMISSÃO INTER-VIVOS DE BENS IMÓVEIS - ITBI,3507200,222451.09,6.34,395639.78,11.28
19114000,MULTAS E JUROS DE MORADO IMPOSTO SI SERVIÇOS DE QUALQUER NATUREZA - lSS,39652000,1965226.19,4.96,3562869.15,8.99
19119800,MULTAS E JUROS DE MORA DAS CONTRIBUIÇÕES DE MELHORIA,7600,397.1,5.22,906.45,11.93
19119900,MULTAS E JUROS DE MORA DE OUTROS TRIBUTOS,4730500,527415,11.15,1060615.48,22.42
19119901,Multas e Juros de Mora do IVV,12600,195.48,1.55,222.78,1.77
19119902,Multas e Juros de Morada Outros Tributos,4717900,527219.52,11.17,1060392.7,22.48
19130000,MULTAS E JUROS DE MORA DA DÍVIDA ATIVA DOS TRIBUTOS,128291100,2590137.95,2.02,12435904.74,9.69
19131100,MULTAS E JUROS DE MORA DA DIVIDA ATIVA DO IMPOSTOS S/A PROPRIEDADE PREDIAL E TERRITORIAL URBANA - IPTU,97775200,1845551.53,1.89,9800763.19,10.02
19131200,MULTAS E JUROS DE MORA DA DÍVIDA ATIVADO IMPOSTOS/A TRANSMISSÃO INTER-VIVOS DE BENS IMÓVEIS - ITBI,669900,5342,0.8,24548.1,3.66
19131300,MULTAS E JUROS DE MORA DA DÍVIDA ATIVA DO IMPOSTO S/ SERVIÇOS DE QUALQUER NATUREZA -ISS,12498800,120445.58,0.96,502069.76,4.02
19139800,MULTAS E JUROS DE MORA DA DIVIDA ATIVA DAS CONTRIBUIÇÕES DE MELHORIA,0,111951.26,0,177310.63,0
19139900,MULTAS E JUROS DE MORA DA DÍVIDA ATIVA DE OUTROS TRIBUTOS,17347200,506847.58,2.92,1931213.06,11.13
19139901,Multas e Juros de Mora da Dívida Ativa do IVV,58200,2517.71,4.33,6204.34,10.66
19139902,Multas e Juros de Mora da Divida Ativa de Outros Tributos,17289000,504329.87,2.92,1925008.72,11.13
19190000,MULTAS DE OUTRAS ORIGENS,363221000,22377330.79,6.16,48322468.3,13.3
19191000,MULTAS PREVISTAS NA LEGISLAÇÃO SANITÁRIA,1000,0,0,0,0
19191001,Multas p/não Fornecimento de Material Preventivo e Educativo AIDS - FMS,0,0,0,0,0
19191002,Multas Previstas na Legislação Sanitána - FMS,1000,0,0,0,0
19191100,MULTAS DIVERSAS,5807100,134951.5,2.32,362242.89,6.24
19191101,Multas SMSF -Sistema Velho,0,0,0,3.15,0
19191102,Multas SMSP - Sistema Novo,5807100,134951.5,2.32,362239.74,6.24
19191103,FUMDES,0,0,0,0,0
19191105,FUNCOR,0,0,0,0,0
19191500,MULTAS PREVISTAS NA LEGISLAÇÃO DE TRÂNSITO,351751800,22151633.98,6.3,47813864.34,13.59
19191501,Multas de Trânsito - DSV,339220200,21393833.78,6.31,46039988.25,13.57
19191502,Multas de Trânsito Veículos de Outros Municípios,12281600,757800.2,6.17,1773876.09,14.44
19191503,Multas p/ Transporte de Produtos Perigosos - DSV,250000,0,0,0,0
19192700,MULTAS E JUROS PREVISTOS EM CONTRATOS,805600,32638.5,4.05,32638.5,4.05
19192701,Multas e Juros -Contratos PMSP,805600,32638.5,4.05,32638.5,4.05
19193200,MULTA DECORRENTE DE SENTENÇA PENAL CONDENATÓRIA,250000,0,0,0,0
19193201,FUMCAD,250000,0,0,0,0
19193202,Multas - Sentença Penal Condenatória - FISC,0,0,0,0,0
19193500,MULTAS POR DANOS AO MEIO AMBIENTE,258800,0,0,0,0
19193501,Poluição Ambiental - DECONT,0,0,0,0,0
19193502,FEMA,258800,0,0,0,0
19195000,MULTAS POR AUTO DE INFRAÇÃO,10000,0,0,0,0
19195001,Multas Auto de Infração - RI,10000,0,0,0,0
19199900,OUTRAS MULTAS,4336700,58106.81,1.34,113722.57,2.62
19199901,Outras Multas,4335700,58106.81,1.34,113722.57,2.62
19199902,Outras Multas - FMS,1000,0,0,0,0
19200000,INDENIZAÇÕES E RESTITUIÇÕES,83965000,14722583.22,17.53,15219138.66,18.13
19210000,INDENIZAÇÕES,300,0,0,0,0
19210100,UTILIZAÇÃO DE RECURSOS HIDRICOS,300,0,0,0,0
19210101,Utilização de Recursos Hídricos - Tratado de Itaipu - Parcelas Vincendas,0,0,0,0,0
19210102,Utilização de Recursos Hídricos -Tratado de Itaipu - Parcelas Vencidas,300,0,0,0,0
19210600,INDENIZAÇÕES P/ DANOS CAUSADOS AO PATRIMÔNIO PÚBLICO,0,0,0,0,0
19210601,Indenizações p/ Calçamentos Repostos,0,0,0,0,0
19219900,OUTRAS INDENIZAÇÕES,0,0,0,0,0
19219901,Outras Indenizações - PMSP,0,0,0,0,0
19220000,RESTITUIÇÕES,83964700,14722583.22,17.53,15219138.66,18.13
19220200,RESTITUIÇÕES DE BENEFICÍOS NÃO DESEMBOLSADOS,0,0,0,0,0
19229900,OUTRAS RESTITUIÇÕES,83964700,14722583.22,17.53,15219138.6,18.13
19229901,Restituições Diversas,83964700,14712611.8,17.52,15209167.24,18.11
19229902,Reembolsos de Salário Família,0,9971.42,0,9971.42,0
19300000,RECEITA DA DIVIDA ATIVA,333710400,5326011.38,1.6,23433444.82,7.02
19310000,RECEITA DA DIVIDA ATIVA TRIBUTÁRIA,314521800,4942466.46,1.57,22346834,7.11
19311100,RECEITA DA DÍVIDA ATIVA DO IMPOSTO S/A PROPRIEDADE PREDIAL E TERRITORIAL URBANA - IPTU,245154400,3939606.73,1.61,17484359.42,7.13
19311200,RECEITA DA DÍVIDA ATIVADO IMPOSTOS/A TRANSMISSÃO INTER-VIVOS DE BENS IMÓVEIS - ITBI - IV,1742400,9244.98,0.53,29895.78,1.72
19311300,RECEITA DA DÍVIDA ATIVA DO IMPOSTO S/ SERVIÇOS DE QUALQUER NATUREZA -ISS,17486500,184789.7,1.06,760630.11,4.35
19319800,RECEITA DA DÍVIDA ATIVA DAS CONTRIBUIÇÕES DE MELHORIA,0,90061.02,0,184023.18,0
19319900,RECEITA DA DÍVIDA ATIVA DE OUTROS TRIBUTOS,50138500,718764.03,1.43,3887925.51,7.75
19319901,Receita da Dívida Ativa do Imposto s/ Venda a Varejo de,20100,2077.87,10.3,5008.77,24.92
19319902,Combustlveis Líquidos e Gasosos - IVV,49174000,716651.37,1.46,3873346.02,7.88
19319903,Receita da Dívida Ativa de Outros Tributos,944400,34.79,0,9570.72,1.01
19320000,FISC,19188600,383544.92,2,1086610.82,5.66
19329900,RECEITA DA DÍVIDA ATIVA NÃO TRIBUTÁRIA,19188600,383544.92,2,1086610.82,5.66
19329901,RECEITA DA DÍVIDA ATIVA NÃO TRIBUTÁRIA DE OUTRAS RECEITAS,100,0,0,0,0
19329902,JUD - Sistema Convencional,19188500,383544.92,2,1086610.82,5.66
19329903,JUD,0,0,"O,0c",0,0
19329904,Receita da Divida Ativa/FEMA,0,0,0,0,0
19900000,Receita da Dívida Ativa/FUMOAD RECEITAS DIVERSAS,220127500,12732484.78,5.78,28218143.54,12.82
19900100,RECEITA DO PROGRAMA DE RECUPERAÇÃO FISCAL E DO PARCELAMENTO ESPECIAL - OUTRAS RECEITAS ,17539500,249019.01,1.42,2783581.39,15.87
19900101,REFIS,17539500,249019.01,1.42,2783581.39,15.87
19900200,RECEITA DE ÔNUS DE SUCUMBÉNCIA DE AÇÕES JUDICIAIS,43952500,816338.96,1.86,9841101.45,22.39
19900201,Receita de Honorários de Advogados,43952500,816338.96,1.86,9841101.45,22.39
19900202,Receita de Ônus de Sucumbência,0,0,0,0,0
19900300,RECEITA DECORRENTE DE ALIENAÇÃO DE BENS APREENDIDOS,4764000,0,0,0,0
19900301,Receita de Leilões de Mercadorias Apreendidas,0,0,0,0,0
19900302,Receita de Alienação de Bens Apreendidos (Leilões -DSV/SPTRANS/CET),4764000,0,0,0,0
19909700,RECUPERAÇÃO DE DESPESAS DE EXERCÍCIOS ANTERIORES,0,0,0,0,0
19909800,DESCONTOS OBTIDOS,0,14.6,0,14.6,0
19909900,OUTRAS RECEITAS,153871500,11667112.21,7.58,15593446.1,10.13
19909901,FEPAC,1120000,7837.53,0.7,17361.87,1.55
19909902,FMS/SMS,0,0,0,0,0
19909903,FUMCAD,0,0,0,0,0
19909904,Tarifa Bancária,230700,9173.23,3.98,21633.71,9.38
19909905,FUNCOR,0,0,0,0,0
19909906,FUTUR,9300,0,0,500,5.38
19909907,FMAS,0,0,0,0,0
19909908,FEMA,1000000,30139.7,3.01,57494.82,5.75
19909909,Saldo não Utilizado do Adiantamento - PMSP,1319800,16892.78,1.28,23316.4,1.77
19909910,Saldo não Utilizado do Adiantamento - FUNDURB/Outorga Onerosa,0,0,0,0,0
19909911,Fundo Especial de Despesas da Câmara Municipal de São Paulo,0,0,0,0,0
19909912,Receita de Cancelamento de Restos a Pagar,146989000,9259345.65,6.3,10440909.95,7.1
19909913,Outras Receitas,3202700,0,0,0,0
19909914,Outras Receitas - FMS,0,0,0,0,0
19909915,Saldo não Utilizado do Adiantamento - FUMCAD,0,0,0,0,0
19909916,Saldo não Utilizado do Adiantamento - FMH,0,0,0,0,0
19909917,Saldo não Utilizado do Adiantamento - FUNCOR,0,0,0,0,0
19909918,Saldo não Utilizado do Adiantamento - FMAS,0,0,0,0,0
19909919,Saldo não Utilizado do Adiantamento - FEMA,0,0,0,0,0
19909920,Saldo não Utilizado do Adiantamento - FEPAC,0,0,0,0,0
19909921,Saldo não Utilizado do Adiantamento - FUTUR,0,0,0,0,0
19909922,Eventuais Diversos - PMSP ,0,2343723.32,0,5032229.35,0
20000000,RECEITAS DE CAPITAL,1095211600,2236440.62,0.2,91372774.16,8.34
21000000,OPERAÇÕES DE CRÉDITO,443892900,0,0,0,0
21100000,OPERAÇÕES DE CRÉDITOS INTERNAS,241058200,0,0,0,0
21110000,TÍTULOS DE RESPONSABILIDADE DO TESOURO,0,0,0,0,0
21110100, TÍTULOS DE RESPONSABILIDADE DO TESOURO - REFINANCIAMENTO DA DÍVIDA PÚBLICA,0,0,0,0,0
21140000,OPERAÇÕES DE CRÉDITO INTERNAS CONTRATUAIS RELATIVAS A PROGRAMAS DE GOVERNO,241058200,0,0,0,0
21140500,OPERAÇÕES DE CRÉDITO INTERNAS P/ PROAMAS DE MODERNIZAÇÃO DA ADMINISTRAÇÃO PÚBLICA,38000000,0,0,0,0
21140501,Programa de Modernização da Administração Tributária -PMAT/BNDES,38000000,0,0,0,0
21149900,OUTRAS OPERAÇÕES DE CRÉDITO INTERNAS RELATIVAS A PROGRAMA DE GOVERNO,203058200,0,0,0,0
21149901,Habitação - CEF,0,0,0,0,0
21149902,Transporte I - BNDES,1045200,0,0,0,0
21149903,Transporte II - BNDES,22013000,0,0,0,0
21149904,Transporte III - BNDES,180000000,0,0,0,0
21200000,OPERAÇÕES DE CRÉDITO EXTERNAS,202834700,0,0,0,0
21230000,OPERAÇÕES DE CRÉDITO EXTERNAS CONTRATUAIS RELATIVAS A PROGRAMAS DE GOVERNO,202834700,0,0,0,0
21230300,OPERAÇÕES DE CRÉDITO EXTERNAS PARA PROGRAMAS DE SANEAMENTO,50334700,0,0,0,0
21230301,PROCAV I- BID,0,0,0,0,0
21230302,PROCAV II - BID,50334700,0,0,0,0
21239900,OUTRAS OPERAÇÕES DE CRÉDITO EXTERNAS RELATIVAS A PROGRAMAS DE GOVERNO,152500000,0,0,0,0
21239901,PROCENTRO - BID,152500000,0,0,0,0
21239902,Habitação - BID,0,0,0,0,0
22000000,ALIENAÇÃO DE BENS,128564500,46.47,0,46.47,0
22100000,ALIENAÇÃO DE BENS MÓVEIS,1537000,46.47,0,46.47,0
22200000,ALIENAÇÃO DE BENS IMÓVEIS,127027500,0,0,0,0
23000000,AMORTIZAÇÃO DE EMPRÉSTIMOS,2959600,281506.48,9.51,509585.68,17.22
23009900,AMORTIZAÇÃO DE FINANCIAMENTOS DIVERSOS,2959600,281506.48,9.51,509585.68,17.22
23009901,Amortização das Dívidas com INSS-ANHEMBI,527600,55653.63,10.55,100745.09,19.09
23009902,Amortização das Dívidas com INSS - CET,151200,12780.39,8.45,23135.19,15.3
23009903,Amortização das DIvidas com INSS - CCHAB,0,0,0,0,0
23009904,Amortização das Dividas com INSS - PRODAM,186300,19452.1,10.44,35212.37,18.9
23009905,Amortização das Dívidas com INSS - SPTRANS,2002900,184414.9,9.21,333829.58,16.67
23009906,Amortização das Dívidas com INSS - EMURB,91600,9205.26,10.05,16663.45,18.19
24000000, TRANSFERÉNCIAS DE CAPITAL,339713400,1805654.66,0.53,33063829.1,9.73
24200000,TRANSFERÊNCIAS INTERGOVERNAMENTAIS,156340700,1156850.36,0.74,26316713.35,16.83
24210000,TRANSFERÊNCIAS DA UNIÃO,156340700,1156850.36,0.74,26316713.35,16.83
24210100,TRANSFERÉNCIAS DE RECURSOS DO SISTEMA ÚNICO DE SAÚDE - SUS,14490500,330000,2.28,330000,2.28
24210101,Transferências de Recursos do SUS,0,0,0,0,0
24210102,Projetos Municipais de Expansão da Saúde da Família - Proesf -FNS/FMS (FUMDES),6519300,0,0,0,0
24210103,Programa Nacional de HIV AIDS/DST - FMS,1050000,0,0,0,0
24210104,Piso da Atenção Básica - PAB - Epidemiologia e Controle de Doenças - FMS,4921200,0,0,0,0
24210105,Gestão Plena do Sistema Municipal de Saúde - FMS,2000000,0,0,0,0
24210106,Programa Farmácia Popular do Brasil - FNS/FMS,0,0,0,0,0
24210107,Programa Centros de Especialidades Odontológicas - FNS/FMS,0,330000,0,330000,0
24210200,TRANSFERÉNCIAS DE RECURSOS DESTINADOS A PROGRAMAS DE EDUCAÇÃO,1630000,758176.56,46.51,758176.56,46.51
24210201,Programa Nacional de Alimentação Escolar - PNAE/FNDE,692000,0,0,0,0
24210202, Programa Dinheiro Direto na Escola - PDDE/FNDE,938000,758176.56,80.83,758176.56,80.83
24219900,OUTRAS TRANSFÉNCIAS DA UNIÃO,140220200,68673.8,0.05,25228536.79,17.99
24219901,Fundo Especial Lei 7525/86 - Petrobras,797500,68673.8,8.61,143016.79,17.93
24219902,Programa de Reestruturação Urbana - Sistema Viário Jacu-Pêssego/Ministério das Cidades/CEF,35000000,0,0,0,0
24219903,Terminal Femão Dias/Ministério dos Transportes,3000000,0,0,0,0
24219904,Fundação Ensino Técnico e Superior,7000000,0,0,0,0
24219905,Radial Leste,10000000,0,0,0,0
24219906,Programa de Drenagem/Ministério da Integração Nacional,20000000,0,0,0,0
24219908,Programa Morar Melhor- Contrato n’ 157896-38/2003 - Ministério das Cidades/CEF,0,0,0,0,0
24219909,Programa Brasil Potência Esportiva,1079800,0,0,0,0
24219910,Esporte Solidário,0,0,0,85520,0
24219911,Ministério do Esporte/CEF xSEME,0,0,0,0,0
24219912,Programa Morar Melhor,342900,0,0,0,0
24219913,Programa de Reestruturação Urbana - Sistema Viário - Ministério das Cidades/CEF,0,0,0,0,0
24219914,Programa Morar no Centro ,3000000,0,0,0,0
24219915,Programa Bairro Legal,35000000,0,0,25000000,71.43
24219916,Programa Mutirão/SEHAB,25000000,0,0,0,0
24220000,TRANSFERÉNCIAS DOS ESTADOS,0,0,0,0,0
24220100,TRANSFERÉNCIAS DE RECURSOS DO SISTEMA ÚNICO DE SAÚDE - SUS,0,0,0,0,0
24220101,SECRETARIA DE ESTADO DA SAÚDE - SMS/FMS ,0,0,0,0,0
24229900,OUTRAS TRANSFERÉNCIAS DOS ESTADOS,0,0,0,0,0
24300000,TRANSFERÉNCIAS DE INSTITUIÇÕES PRIVADAS,2088900,0,0,0,0
24300001,Planetário do Parque do lbirapuera/Nestlé Brasill Ltda.,0,0,0,0,0
24300002,Planetário do Parque do Ibirapuera,1200000,0,0,0,0
24300003,Reforma da Escola Municipal de Astrofísica,888900,0,0,0,0
24400000,TRANSFERÊNCIAS DO EXTERIOR,1627000,613691.3,37.72,613691.3,37.72
24400100,PROJETO COORDENADORIA ESPECIAL DA MULHER,1627000,0,0,0,0
24400200,Programa URB-AL - Projeto Comum R5-B2-04 - Centros de Cidadania da Mulher,0,613691.3,0,613691.3,0
24700000,TRANSFERÊNCIAS DE CONVÊNIOS,179656800,35113,0.02,6133424.45,3.41
24710000,TRANSFERÊNCIAS DE CONVÊNIOS DA UNIÃO E DE SUAS ENTIDADES,179656800,35113,0.02,6133424.45,3.41
24710100,TRANSFERÉNCIAS DE CONVÊNIO DA UNIÃO P/O SISTEMA ÚNICO DE SAÚDE - SUS,169403800,35113,0.02,6133424.45,3.62
24710101,Convênio DST/AIDS/FMS,1000,0,0,0,0
24710102,Convênio Dengue/FMS,0,0,0,0,0
24710103,Outros Convênios SMS/FMS,93402800,35113,0.04,6133424.45,6.57
24710104,CEUs Saúde,6000000,0,0,0,0
24710105,Hospital MBoi Mirim,40000000,0,0,0,0
24710106,Hospital Cidade Tiradentes,30000000,0,0,0,0
24710200,TRANSFERÊNCIAS DE CONVÊNIO DA UNIÃO DESTINADAS A PROGRAMAS DE EDUCAÇÃO,2508000,0,0,0,0
24710201,Convênio MEC/FNDE - Assistência Financeira a Programas e Projetos Educacionais,108000,0,0,0,0
24710202,Convênio n° 800072/03 - FNDE/MEC - Educação Pré-Escolar,0,0,0,0,0
24710203,Convênio n° 804142/03 - FNDE/MEC - Ensino Fundamental,0,0,0,0,0
24710204,Convênio n° 808065/03 - FNDEIMEC - Educação de Jovens e Adultos,0,0,0,0,0
24710205,Convênio r 816169/2003 - FNDE/MEC - Educação Especial/Curso de Capacitação de Docentes,0,0,0,0,0
24710206,Convênio n° 820005/2003 - FNDE/MEC - Ensino Fundamental/Formação Continuada de Docentes da 5 a 8 séries,0,0,0,0,0
24710207,Convênio n° 828118/2003 - FNDEIMEC - Curso de Alfabetização de Jovens e Adultos,0,0,0,0,0
24710208,Centro Municipal de Educação Tecnológica - Convênio MEC/CEFET-SP,2400000,0,0,0,0
24719900,OUTRAS TRANSFERÊNCIAS DE CONVÊNIO DA UNIÃO,7745000,0,0,0,0
24719901,Convênio Secretaria Nacional de Segurança Pública - SENASP N° 165/01,0,0,0,0,0
24719902,Convênio Secretaria Nacional de Segurança Pública - SENASP N°161/02,0,0,0,0,0
24719903,Convênio Ministério de Integração Nacional,0,0,0,0,0
24719904,Projeto Mais Esporte no Segundo Tempo (Convênio/ME/PMSP nº 60/2003) - SEME/DEPEL,0,0,0,0,0
24719905,Programa de Modernização do Sistema de Controle Externo dos Estados e Municípios Brasileiros - Promoex/MP/BID,0,0,0,0,0
24719906,Convênio Secretaria Nacional de Segurança Pública - SENASP nº006/03,0,0,0,0,0
24719907,Convênio Secretaria Nacional de Segurança Pública - SENASP,7745000,0,0,0,0
24719908,Programa Rede Solidária de Restaurantes Populares -PMSP/SEMAB/MDS,0,0,0,0,0
24719909,Programa Banco Municipal de Alimentos - PMSP/SEMAB/MDS,0,0,0,0,0
24719910, PMSP/SDTS - Plansine - FAT,0,0,0,0,0
24719911,Convênios MINC/SMC,0,0,0,0,0
25000000,OUTRAS RECEITAS DE CAPITAL,180081200,149233.01,0.08,57799312.91,32.1
25900000,OUTRAS RECEITAS,160081200,149233.01,0.08,57799312.91,32.1
25900100,RECEITAS DIVERSAS,180081200,149233.01,0.08,57799312.91,32.1
25900101,PMSP,0,0,0,0,0
25900102,FUMCAD,0,0,0,0,0
25900103,FUMDES,0,0,0,0,0
25900104,Operação Urbana Faria Lima,0,0,0,0,0
25900106,Operações Urbana Anhangabaú,0,0,0,0,0
25900107,Programa de Urbanização e Verticalização em Favelas - Prover -Cingapura,0,11.25,0,11.25,0
25900108,Fundo Especial Operação Urbana Água Branca - FEAB,0,0,0,0,0
25900109,Programa de Recuperação Urbana e Saneamento Ambiental da Bacia do Guarapiranga,0,0,0,0,0
25900110,Reassentamerito de Famllias - Programa PROCAV II,0,0,0,0,0
25900111,FEHIDRO - Vizinhança Verde,0,0,0,1317.32,0
25900112,Fundo de Desenvolvimento Urbano - FUNDURB,108900000,0,0,0,0
25900113,Outorga Onerosa - Plano Diretor,0,143482.42,0,184076.82,0
25900114,Outorga Onerosa - Lei de Anistia,0,5739.34,0,5739.34,0
25900115,Precatórios,71181200,0,0,57608168.18,80.93
25900116,Fundo Espacial de Despesas da Câmara Municipal de São Paulo,0,0,0,0,0
25900117,Receita de Cancelamento de Restos a Pagar,0,0,0,0,0
25900118,PMSP/SEMAB -Torres do Mercado Central ,0,0,0,0,0
90000000,DEDUÇÕES DA RECEITA CORRENTE,-491662500,-34141788.94,6.94,-74486688.65,15.15
97000000,DEDUÇÕES DE TRANSFERÉNCIAS CORRENTES ,-491662500,-34141788.94,6.94,-74486688.65,15.15
97200000,DEDUÇÕES DE TRANSFERÊNCIAS INTERGOVERNAMENTAIS,-491662500,-34141788.94,6.94,-74486688.65,15.15
97210000, DEDUÇÕES DE TRANSFERÊNCIAS DA UNIÃO,-32226700,-1861775.09,5.78,-3875542.87,12.03
97210100,DEDUÇÃO DE RECEITA PARA A FORMAÇÃO DO FUNDEF - TRANSFERÊNCIA DA UNIÃO,-11357100,-1067788.45,9.4,-2287569.59,20.14
97210102,Dedução de Receita para a Formação do FUNDEF - FPM (corresp. 1721.01.02 cota parte do FPM),-11357100,-1067788.45,9.4,-2287569.59,20.14
97210900,DEDUÇÃO DE RECEITA PARA A FORMAÇÃO DO FUNDEF - ICMS ,-20869600,-793986.64,3.8,-1587973.28,7.61
97210901,Dedução de Receita para a Formação do FUNDEF - ICMS - Desoneração- L. C. 87/96(corresp. 1721.09.01),-20869600,-793986.64,3.8,-1587973.28,7.61
97220000,DEDUÇÕES DE TRANSFERÊNCIAS DO ESTADO ,-459435800,-32280013.85,7.03,-70611145.78,16.37
97220100,DEDUÇÃO DE RECEITA PARA A FORMAÇÃO DO FUNDEF - TRANSFERÊNCIA DOS ESTADOS,-459435800,-32280013.85,7.03,-70611145.78,15.37
97220101,Dedução de Receita para a Formação do FUNDEF - ICMS (corresp. 1722.01.01 cota parte do ICMS),-455352600,-31950270.8,7.02,-69910999.14,15.35
97220104,Dedução de Receita para a Formação FUNDEF-IPI Exportação(correso.1722.01.04 cota parte IPI),-4083200,-329743.05,8.08,-700146.64,17.15
