codigo,especificacao_da_receita,receita_orcada,realizada_no_mes,pct_realizada_mes_sobre_o_orcado,realizada_ate_o_mes,pct_ate_o_mes_sobre_o_orcado
993299000000,DEDUÇÕES DA RECEITA DA DÍVIDA ATIVA  NÂO TRIBUTÁRIA DE OUTRAS RECEITAS,0,0,0,-740.79,0
993299060000,DEDUÇÕES DA RECEITA DA DÍVIDA ATIVA NÃO TRIBUTÁRIA DE OUTRAS RECEITAS,0,0,0,-740.79,0
999000000000,DEDUÇÕES DAS RECEITAS DIVERSAS,0,-4811.92,0,-81696.52,0
999001000000,DEDUÇÕES DE RECEITA DO PROGRAMA DE RECUPERAÇÃO FISCAL E DO PARCELAMENT,0,-4765.52,0,-22302.43,0
999001020000,DEDUÇÕES DO PROGRAMA DE PARCELAMENTO INCENTIVADO - PPI,0,-4765.52,0,-22302.43,0
999002000000,DEDUÇÕES DA RECEITA DE ÔNUS DE SUCUMBÊNCIA DE AÇÕES JUDICIAIS,0,0,0,-79.93,0
999002010000,DEDUÇÕES DA RECEITA DE HONORÁRIOS DE ADVOGADOS,0,0,0,-79.93,0
999099000000,DEDUÇÕES DE OUTRAS RECEITAS,0,-46.4,0,-59314.16,0
999099080000,DEDUÇÕES DAS OUTRAS RECEITAS - FEMA,0,-46.4,0,-46.4,0
999099220000,DEDUÇÕES DE EVENTUAIS DIVERSOS - PMSP,0,0,0,-59267.76,0
TOTAL GERAL,,36171055404,2538657835.91,7.01847874648761,31665168060.82,87.5428369649349
