codigo,especificacao_da_receita,receita_orcada,realizada_no_mes,pct_realizada_mes_sobre_o_orcado,realizada_ate_o_mes,pct_ate_o_mes_sobre_o_orcado
191140000000,MULTAS E JUROS DE MORA DO IMPOSTO S/ SERVIÇOS DE QUALQUER NATUREZA - I,72716257,6812630.81,9.37,29575836.11,40.67
191140010000,MULTAS E JUROS DE MORA DO IMPOSTO S/ SERVIÇOS DE QUALQUER NATUREZA - I,63472625,6083651.38,9.58,26695786.85,42.06
191140020000,MULTAS E JUROS DE MORA DO ISSQN - SIMPLES NACIONAL,9243632,728979.43,7.89,2880049.26,31.16
191198000000,MULTAS E JUROS DE MORA DAS CONTRIBUIÇÕES DE MELHORIA,612,0,0,0,0
191198010000,MULTAS E JUROS DE MORA DAS CONTRIBUIÇÕES DE MELHORIA,612,0,0,0,0
191199000000,MULTAS E JUROS DE MORA DE OUTROS TRIBUTOS,7886330,524701.77,6.65,2563504.42,32.51
191199010000,MULTAS E JUROS DE MORA DE OUTROS TRIBUTOS,7886330,524701.77,6.65,2563504.42,32.51
191300000000,MULTAS E JUROS DE MORA DA DÍVIDA ATIVA DOS TRIBUTOS,130114866,8976091.46,6.9,42227365.1,32.45
191311000000,MULTAS E JUROS DE MORA DA DÍVIDA ATIVA DO IMPOSTO S/ A PROPRIEDADE PRE,94370983,6181940.76,6.55,27046980.46,28.66
191311010000,MULTAS E JUROS DE MORA DA DÍVIDA ATIVA DO IMPOSTO S/A PROPRIEDADE PRED,94370983,6181940.76,6.55,27046980.46,28.66
191312000000,MULTAS E JUROS DE MORA DA DÍVIDA ATIVA DO IMPOSTO S/ A TRANSMISSÃO INT,281710,36101.1,12.81,180511.17,64.08
191312010000,MULTAS E JUROS DE MORA DA DÍVIDA ATIVA DO IMPOSTO S/A TRANSMISSÃO INTE,281710,36101.1,12.81,180511.17,64.08
191313000000,MULTAS E JUROS DE MORA DA DÍVIDA ATIVA DO IMPOSTO S/ SERVIÇOS DE QUALQ,16888029,1334856.7,7.9,7876823.97,46.64
191313010000,MULTAS E JUROS DE MORA DA DÍVIDA ATIVA DO IMPOSTO S/ SERVIÇOS DE QUALQ,16888029,1295806.86,7.67,7322771.72,43.36
191313020000,MULTAS E JUROS DE MORA DA DIV.ATIVA ISS SIMP.NAC,0,39049.84,0,554052.25,0
191398000000,MULTAS E JUROS DE MORA DA DÍVIDA ATIVA DAS CONTRIBUIÇÕES DE MELHORIA,167216,10003.58,5.98,33868.7,20.25
191398010000,MULTAS E JUROS DE MORA DA DÍVIDA ATIVA DAS CONTRIBUIÇÕES DE MELHORIA,167216,10003.58,5.98,33868.7,20.25
191399000000,MULTAS E JUROS DE MORA DA DÍVIDA ATIVA DE OUTROS TRIBUTOS,18406928,1413189.32,7.68,7089180.8,38.51
191399010000,MULTAS E JUROS DE MORA DA DÍVIDA ATIVA DO IVV,0,0,0,9.13,0
191399020000,MULTAS E JUROS DE MORA DA DÍVIDA ATIVA DE OUTROS TRIBUTOS,18406928,1413189.32,7.68,7089171.67,38.51
191900000000,MULTAS DE OUTRAS ORIGENS,880228072,69671001.13,7.92,356457389.63,40.5
191910000000,MULTAS PREVISTAS NA LEGISLAÇÃO SANITÁRIA,1440000,0,0,0,0
191910020000,MULTAS PREVISTAS NA LEGISLAÇÃO SANITÁRIA - FMS,1440000,0,0,0,0
191911000000,MULTAS DIVERSAS,20647714,2607135.42,12.63,10334344.49,50.05
191911010000,MULTAS SMSP - SISTEMA VELHO,0,0,0,2634.69,0
191911020000,MULTAS SMSP - SISTEMA NOVO,20647714,2607135.42,12.63,10331709.8,50.04
191915000000,MULTAS PREVISTAS NA LEGISLAÇÃO DE TRÂNSITO,832356316,57973364.88,6.96,311928785.9,37.48
191915010000,MULTAS DE TRÂNSITO - DSV,812154316,56761938.66,6.99,305440862.59,37.61
191915020000,MULTAS DE TRÂNSITO VEÍCULOS DE OUTROS MUNICÍPIOS,2000,0,0,0,0
191915030000,MULTAS P/ TRANSPORTE DE PRODUTOS PERIGOSOS - DSV,200000,94586.97,47.29,620662.86,310.33
191915040000,MULTAS DE TRÂNSITO DE VEÍCULOS DE OUTROS ESTADOS - RENAINF,20000000,1116839.25,5.58,5867260.45,29.34
191927000000,MULTAS E JUROS PREVISTOS EM CONTRATOS,12130879,6095677.24,50.25,17854381.51,147.18
191927020000,MULTAS E JUROS/ CONTRATOS PMSP,12130879,6095677.24,50.25,17854381.51,147.18
191932000000,MULTA DECORRENTE DE SENTENÇA PENAL CONDENATÓRIA,0,6620,0,13730.44,0
191932010000,FUMCAD,0,6620,0,13730.44,0
191935000000,MULTAS POR DANOS AO MEIO AMBIENTE,11712000,2641307.68,22.55,14328520.2,122.34
191935020000,FEMA,912000,10731.92,1.18,81697.65,8.96
191935030000,MULTAS POR FALTA DE INSPEÇÃO VEICULAR - FEMA,10800000,2630575.76,24.36,14246822.55,131.92
191950000000,MULTAS POR AUTO DE INFRAÇÃO,800000,0,0,0,0
191950020000,MULTAS POR AUTO DE INFRAÇÃO - FUNCAP,800000,0,0,0,0
191999000000,OUTRAS MULTAS,1141163,346895.91,30.4,1997627.09,175.05
191999010000,MULTAS E JUROS DIVERSOS - PMSP,1141163,346895.91,30.4,1997627.09,175.05
192000000000,INDENIZAÇÕES E RESTITUIÇÕES,48945690,7157456.8,14.62,36214622.49,73.99
192100000000,INDENIZAÇÕES,0,0,0,6880,0
192199000000,OUTRAS INDENIZAÇÕES,0,0,0,6880,0
192199010000,OUTRAS INDENIZAÇÕES - PMSP,0,0,0,6880,0
192200000000,RESTITUIÇÕES,48945690,7157456.8,14.62,36207742.49,73.98
192299000000,OUTRAS RESTITUIÇÕES,48945690,7157456.8,14.62,36207742.49,73.98
192299010000,RESTITUIÇÕES DIVERSAS,48578309,7132066.51,14.68,35326552.15,72.72
192299020000,REEMBOLSOS DE SALÁRIO FAMÍLIA,293381,21003.14,7.16,61028.9,20.8
192299030000,RESTITUIÇÕES DIVERSAS - FMS,74000,4387.15,5.93,820161.44,1108.33
193000000000,RECEITA DA DÍVIDA ATIVA,229442544,16184106.51,7.05,80780259.42,35.21
193100000000,RECEITA DA DÍVIDA ATIVA TRIBUTÁRIA,205442544,14572709.98,7.09,72174398.38,35.13
193111000000,RECEITA DA DÍVIDA ATIVA DO IMPOSTO S/A PROPRIEDADE PREDIAL E TERRITORI,167661691,11192600.88,6.68,48699477.42,29.05
193112000000,RECEITA DA DÍVIDA ATIVA DO IMPOSTO S/A TRANSMISSÃO INTER-VIVOS DE BENS,288582,43562.9,15.1,176685.53,61.23
193113000000,RECEITA DA DÍVIDA ATIVA DO IMPOSTO S/ SERVIÇOS DE QUALQUER NATUREZA -,26317103,2463566.63,9.36,17149596.83,65.17
193118000000,RECEITA DA DÍVIDA ATIVA DO ISS - SIMPLES NACIONAL,0,256219.36,0,3502059.63,0
193198000000,RECEITA DA DÍVIDA ATIVA DAS CONTRIBUIÇÕES DE MELHORIA,140670,10091.3,7.17,26405.82,18.77
193199000000,RECEITA DA DÍVIDA ATIVA DE OUTROS TRIBUTOS,11034498,606668.91,5.5,2620173.15,23.75
193199010000,RECEITA DA DÍVIDA ATIVA DE OUTROS TRIBUTOS - PRINCIPAL - PMSP,11033842,606883.65,5.5,2616142.65,23.71
193199030000,FISC,656,-214.74,-32.73,3990.03,608.24
193199040000,RECEITA DA DÍVIDA ATIVA DO IMPOSTO S/ VENDA A VAREJO DE COMBUSTÍVEIS L,0,0,0,40.47,0
193200000000,RECEITA DA DÍVIDA ATIVA NÃO TRIBUTÁRIA,24000000,1611396.53,6.71,8605861.04,35.86
193299000000,RECEITA DA DÍVIDA ATIVA NÃO TRIBUTÁRIA DE OUTRAS RECEITAS,24000000,1611396.53,6.71,8605861.04,35.86
193299030000,RECEITA DA DÍVIDA ATIVA/FEMA,0,0,0,101241.41,0
193299060000,JUD,24000000,1611396.53,6.71,8503658.19,35.43
193299080000,RECEITA DA DÍVIDA ATIVA/FMDT,0,0,0,961.44,0
199000000000,RECEITAS DIVERSAS,646187314,65681804.97,10.16,377811665.77,58.47
199001000000,RECEITA DO PROGRAMA DE RECUPERAÇÃO FISCAL E DO PARCELAMENTO ESPECIAL -,485013974,59786000.48,12.33,341225238.92,70.35
199001010000,REFIS,210864,-13235.13,-6.28,1226.84,0.58
199001020000,PROGRAMA DE PARCELAMENTO INCENTIVADO - PPI,70504946,6442007.42,9.14,31794032.05,45.09
199001030000,PROGRAMA DE PARCELAMENTO INCENTIVADO - PPI - DECRETO N° 48260/2007,30463469,3042663.65,9.99,14952044.11,49.08
199001040000,PARCELAMENTO ESPECIAL PARA INGRESSO NO SIMPLES NACIONAL - PISN,333973,31915.74,9.56,147167.53,44.07
199001050000,PARCELAMENTO ADMINISTRATIVO DE DÉBITOS TRIBUTÁRIOS - PAT,48374829,7450600.44,15.4,33135067.81,68.5
199001060000,PROGRAMA DE PARCELAMENTO INCENTIVADO PPI 2008,26081469,2315261,8.88,11835982,45.38
199001070000,PROGRAMA DE PARCELAMENTO INCENTIVADO - PPI 2009,33279984,3226856.01,9.7,14965767.92,44.97
199001080000,PROGRAMA DE PARCELAMENTO INCENTIVADO - PPI 2010,89890956,8373808.3,9.32,56069816.22,62.38
199001140000,PROGRAMA DE PARCELAMENTO INCENTIVADO - PPI 2011,185873484,28916123.05,15.56,178324134.44,95.94
199002000000,RECEITA DE ÔNUS DE SUCUMBÊNCIA DE AÇÕES JUDICIAIS,54689932,3398774.36,6.21,15125580.63,27.66
199002010000,RECEITA DE HONORÁRIOS DE ADVOGADOS,54677382,3391276.91,6.2,15110787.31,27.64
199002020000,RECEITA DE ÔNUS DE SUCUMBÊNCIA,12550,7497.45,59.74,14793.32,117.88
199003000000,RECEITA DECORRENTE DE ALIENAÇÃO DE BENS APREENDIDOS,0,0,0,38700,0
199003010000,RECEITA DE LEILÕES DE MERCADORIAS APREENDIDAS,0,0,0,38700,0
199099000000,OUTRAS RECEITAS,106483408,2497030.13,2.34,21422146.22,20.12
199099010000,FEPAC,600000,511216.14,85.2,1509461.87,251.58
199099080000,FEMA,10356343,3547748.46,34.26,11096021.34,107.14
199099090000,SALDO NÃO UTILIZADO DO ADIANTAMENTO,0,142356.95,0,556803.6,0
199099100000,SALDO NÃO UTILIZADO DO ADIANTAMENTO - FUNDURB/OUTORGA ONEROSA,0,0,0,715.63,0
199099110000,FUNDO ESPECIAL DE DESPESAS DA CÂMARA MUNICIPAL DE SÃO PAULO,1500000,105577.85,7.04,575085.83,38.34
199099220000,EVENTUAIS DIVERSOS - PMSP,86686144,-1893190.32,-2.18,7158401.57,8.26
199099230000,LEILÕES - DSV/SPTRANS/CET,1000,0,0,0,0
199099240000,LEILÕES - DTP,1000,0,0,0,0
199099270000,LEILÕES - FUNDIP,100000,0,0,22500,22.5
199099290000,SALDO NÃO UTILIZADO DO ADIANTAMENTO - FMS,0,1045,0,1539.72,0
199099300000,RESSARCIMENTO DE DESPESAS DE PESSOAL REQUISITADO - PMSP,1459289,82297.37,5.64,484037.41,33.17
199099310000,RESSARCIMENTO DE DESPESAS DE PESSOAL REQUISITADO - IPREM,2807832,0,0,0,0
199099350000,RESSARCIMENTO DE DESPESAS DE PESSOAL REQUISITADO - FUNDAÇÃO,22800,0,0,0,0
199099360000,FUNDO ESPECIAL DE DESPESAS DO TCM,2949000,0,0,0,0
199099990000,DOCUMENTOS ELETRÔNICOS A CLASSIFICAR,0,-21.32,0,17579.25,0
200000000000,RECEITAS DE CAPITAL,4195396926,146203737.51,3.48,1110829185.83,26.48
210000000000,OPERAÇÕES DE CRÉDITO,109058209,24440731.67,22.41,24440731.67,22.41
211000000000,OPERAÇÕES DE CRÉDITO INTERNAS,6885000,0,0,0,0
211400000000,OPERAÇÕES DE CRÉDITO INTERNAS - CONTRATUAIS,6885000,0,0,0,0
211405000000,OPERAÇÕES DE CRÉDITO INTERNAS P/ PROGRAMAS DE MODERNIZAÇÃO DA ADMINIST,6885000,0,0,0,0
211405010000,PROGRAMA DE MODERNIZAÇÃO DA ADMINISTRAÇÃO TRIBUTÁRIA - PMAT/BNDES,6885000,0,0,0,0
212000000000,OPERAÇÕES DE CRÉDITO EXTERNAS,102173209,24440731.67,23.92,24440731.67,23.92
212300000000,OPERAÇÕES DE CRÉDITO EXTERNAS - CONTRATUAIS,102173209,24440731.67,23.92,24440731.67,23.92
212399000000,OUTRAS OPERAÇÕES DE CRÉDITO EXTERNAS - CONTRATUAIS,102173209,24440731.67,23.92,24440731.67,23.92
212399010000,PROCENTRO - BID,59426509,24440731.67,41.13,24440731.67,41.13
212399030000,PNAFM,42746700,0,0,0,0
220000000000,ALIENAÇÃO DE BENS,1380945500,722611.82,0.05,740232992.86,53.6
221000000000,ALIENAÇÃO DE BENS MÓVEIS,1035500000,337776.5,0.03,738327372.5,71.3
221001000000,ALIENAÇÃO DE BENS MÓVEIS,500000,337776.5,67.56,445656.5,89.13
221100000000,ALIENAÇÃO DE TÍTULOS MOBILIÁRIOS,0,0,0,737881716,0
221101000000,ALIENAÇÃO DE TÍTULOS MOBILIÁRIOS - CEPAC,0,0,0,737881716,0
221101030000,OPERAÇÃO URBANA ÁGUA ESPRAIADA,0,0,0,737881716,0
221900000000,ALIENAÇÃO DE OUTROS BENS MÓVEIS,1035000000,0,0,0,0
221900030000,CESSÃO DE DIREITOS CREDITÓRIOS - PPI,500000000,0,0,0,0
221900040000,CESSÃO DE DIREITOS CREDITÓRIOS - FMSAI,300000000,0,0,0,0
221900050000,CESSÃO DO SISTEMA DE BILHETAGEM ELETRÔNICA,235000000,0,0,0,0
222000000000,ALIENAÇÃO DE BENS IMÓVEIS,345445500,384835.32,0.11,1905620.36,0.55
222900000000,ALIENAÇÃO DE OUTROS BENS IMÓVEIS,345445500,384835.32,0.11,1905620.36,0.55
222900010000,ALIENAÇÃO DE OUTROS BENS IMÓVEIS,345445500,384835.32,0.11,1905620.36,0.55
230000000000,AMORTIZAÇÃO DE EMPRÉSTIMOS,7440993,470682.64,6.33,3499214.84,47.03
230099000000,AMORTIZAÇÃO DE EMPRÉSTIMOS DIVERSOS,7440993,470682.64,6.33,3499214.84,47.03
230099010000,AMORTIZAÇÃO DAS DÍVIDAS COM INSS - ANHEMBI,1477526,97478.37,6.6,724687.38,49.05
230099020000,AMORTIZAÇÃO DAS DÍVIDAS COM INSS - CET,306683,0,0,0,0
230099040000,AMORTIZAÇÃO DAS DÍVIDAS COM INSS - PRODAM,514866,34077.42,6.62,253343.16,49.21
230099050000,AMORTIZAÇÃO DAS DÍVIDAS COM INSS - SPTRANS,4898274,323029.5,6.59,2401511.15,49.03
230099060000,AMORTIZAÇÃO DAS DÍVIDAS COM INSS - EMURB,243644,16097.35,6.61,119673.15,49.12
240000000000,TRANSFERÊNCIAS DE CAPITAL,1579841069,89920809.74,5.69,218515580.59,13.83
242000000000,TRANSFERÊNCIAS INTERGOVERNAMENTAIS,429412607,7314224.16,1.7,10334803.34,2.41
242100000000,TRANSFERÊNCIAS DA UNIÃO,399355607,7314224.16,1.83,10334803.34,2.59
242101000000,TRANSFERÊNCIAS DE RECURSOS DO SISTEMA ÚNICO DE SAÚDE - SUS,0,0,0,370000,0
242101010000,TRANSFERÊNCIAS DE RECURSOS DO SUS,0,0,0,370000,0
242199000000,OUTRAS TRANSFERÊNCIAS DA UNIÃO,399355607,7314224.16,1.83,9964803.34,2.5
242199010000,FUNDO ESPECIAL LEI 7525/86 - PETROBRÁS,2255498,225893.62,10.02,1078600.37,47.82
242199090000,PROGRAMA BRASIL POTÊNCIA ESPORTIVA,16000000,0,0,0,0
242199200000,SEHAB-CT CEF/MIN.CID/PAC (HELIOPOLIS/PQ.FERNANDA/CID A,150000000,7088330.54,4.73,8886202.97,5.92
242199210000,PMSP/SIURB X MIN. CIDADES/CEF/PAC - BACIA DO CÓRREGO CORDEIRO,35849207,0,0,0,0
242199220000,PMSP/SIURB X MIN. CIDADES/CEF/PAC - CÓRREGO PIRAJUSSARA,38729833,0,0,0,0
242199230000,SES - CT CEF/ MIN. CIDADES,5310161,0,0,0,0
242199240000,SGM - CT CEF/MIN. DO TURISMO,3900000,0,0,0,0
242199250000,SIURB X MINISTÉRIO DAS CIDADES,46015169,0,0,0,0
242199270000,SMT/SPTRANS X UNIÃO,11662184,0,0,0,0
242199280000,SEHAB X MINISTÉRIO DAS CIDADES/ PAC 2 - PARAÍSOPOLIS,60000000,0,0,0,0
242199290000,SEHAB X MINISTÉRIO DAS CIDADES/PAC 2 - SÃO FRANCISCO,29633555,0,0,0,0
242200000000,TRANSFERÊNCIAS DOS ESTADOS,30057000,0,0,0,0
242201000000,TRANSFERÊNCIAS DE RECURSOS DO SISTEMA ÚNICO DE SAÚDE - SUS,5057000,0,0,0,0
242201010000,SECRETARIA DE ESTADO DA SAÚDE - SMS/FMS,5057000,0,0,0,0
242299000000,OUTRAS TRANSFERÊNCIAS DOS ESTADOS,25000000,0,0,0,0
242299020000,PROJETO PARQUE TECNOLÓGICO DE SÃO PAULO - ZONA LESTE,25000000,0,0,0,0
244000000000,TRANSFERÊNCIAS DO EXTERIOR,898175,0,0,0,0
244007000000,PROGRAMA ILE DE FRANCE,293561,0,0,0,0
244010000000,PMSP X IDF/ BIRD,604614,0,0,0,0
247000000000,TRANSFERÊNCIAS DE CONVÊNIOS,1149530287,82606585.58,7.19,208180777.25,18.11
247100000000,TRANSFERÊNCIAS DE CONVÊNIOS DA UNIÃO E DE SUAS ENTIDADES,166429593,0,0,0,0
247101000000,TRANSFERÊNCIAS DE CONVÊNIO DA UNIÃO P/ O SISTEMA ÚNICO DE SAÚDE - SUS,3377000,0,0,0,0
247101100000,CONVÊNIOS COM O MINISTÉRIO DA SAÚDE -FMS,3377000,0,0,0,0
247102000000,TRANSFERÊNCIAS DE CONVÊNIO DA UNIÃO DESTINADAS A PROGRAMAS DE EDUCAÇÃO,100000,0,0,0,0
247102010000,CONVÊNIO MEC/FNDE - ASSISTÊNCIA FINANCEIRA A PROGRAMAS E PROJETOS EDUC,100000,0,0,0,0
247199000000,OUTRAS TRANSFERÊNCIAS DE CONVÊNIOS DA UNIÃO,162952593,0,0,0,0
247199070000,CONVÊNIO SECRETARIA NACIONAL DE SEGURANÇA PÚBLICA - SENASP,13353000,0,0,0,0
247199110000,CONVÊNIOS MINC/SMC,7249593,0,0,0,0
247199120000,CONVÊNIO SEME - UNIÂO,5100000,0,0,0,0
247199160000,CONVÊNIO MTE/SPPE/CODEFAT,1250000,0,0,0,0
247199190000,CONVÊNIO MINISTÉRIO DO TURISMO - MARCA DA CIDADE DE SÃO PAULO,6000000,0,0,0,0
247199210000,CONVÊNIO SMSP - UNIÃO,80000000,0,0,0,0
247199220000,CONVÊNIO SGM X UNIÃO,50000000,0,0,0,0
247200000000,TRANSFERÊNCIA DE CONVÊNIOS DOS ESTADOS E DO DISTRITO FEDERAL E DE SUAS,982700694,82606585.58,8.41,208180777.25,21.18
247202000000,TRANSFERÊNCIA DE CONVÊNIO DOS ESTADOS P/ EDUCAÇÃO,40000000,0,0,0,0
247202010000,CONVÊNIO SME X ESTADO,40000000,0,0,0,0
247203000000,TRANSFERÊNCIAS DE CONVÊNIOS DOS ESTADOS DESTINADAS A PROGRAMAS DE SANE,327802144,76479589.74,23.33,171190732.26,52.22
247203010000,CONVÊNIO SEHAB X ESTADO,12000000,0,0,1745630.99,14.55
247203020000,CONVÊNIO PMSP X SABESP - FUNDO MUNICIPAL DE SANEAMENTO AMBIENTAL E INF,306502156,76479589.74,24.95,169208083.53,55.21
247203040000,CONVÊNIO PMSP X SABESP,9299988,0,0,237017.74,2.55
247299000000,OUTRAS TRANSFERÊNCIAS DE CONVÊNIO DOS ESTADOS,614898550,6126995.84,1,36990044.99,6.02
247299050000,CONVÊNIO CDHU X SEHAB,263000000,1143288.99,0.43,16709049.62,6.35
247299060000,CONVÊNIO SEME - ESTADO,19799270,0,0,0,0
247299070000,CT / CEF / SEHAB / MIN. CIDADES / PAC ESTADUAL / MANANCIAIS LOTES I A,278600000,2494491.8,0.9,14253211.67,5.12
247299100000,CONVÊNIO SEHAB X ESTADO,6000000,2489215.05,41.49,6027783.7,100.46
247299110000,CONVÊNIO SMSP X ESTADO,15699280,0,0,0,0
247299130000,CONVÊNIO PMSP/SNJ X ESTADO,30000000,0,0,0,0
247299140000,CONVÊNIO SMC X ESTADO,1800000,0,0,0,0
247500000000,TRANSFERÊNCIA DE CONVÊNIOS DO EXTERIOR,400000,0,0,0,0
247507000000,CONVÊNIO SVMA X EXTERIOR,400000,0,0,0,0
250000000000,OUTRAS RECEITAS DE CAPITAL,1118111155,30648901.64,2.74,124140665.87,11.1
256000000000,RESTITUIÇÕES,1200000,-1.19,0,0,0
256001000000,RESTITUIÇÕES DIVERSAS,1200000,-1.19,0,0,0
256001010000,RESTITUIÇÕES DIVERSAS,1200000,-1.19,0,0,0
259000000000,OUTRAS RECEITAS,1116911155,30648902.83,2.74,124140665.87,11.11
259001000000,RECEITAS DIVERSAS,1116911155,30648902.83,2.74,124140665.87,11.11
259001040000,OPERAÇÃO URBANA FARIA LIMA,157800348,0,0,3444110.41,2.18
259001070000,PROGRAMA DE URBANIZAÇÃO E VERTICALIZAÇÃO EM FAVELAS - PROVER - CINGAPU,0,0,0,586392.85,0
259001080000,FUNDO ESPECIAL OPERAÇÃO URBANA  ÁGUA BRANCA - FEAB,68205852,0,0,3278402.68,4.81
259001100000,REASSENTAMENTO DE FAMÍLIAS - PROGRAMA PROCAV II,0,0,0,4141053.56,0
259001130000,OUTORGA ONEROSA - PLANO DIRETOR,160000000,21354462.4,13.35,76201834.42,47.63
259001140000,OUTORGA ONEROSA - LEI DE ANISTIA,4171329,848415.68,20.34,4563587.99,109.4
259001160000,FUNDO ESPECIAL DE DESPESAS DA CÂMARA MUNICIPAL DE SÃO PAULO,50000,0,0,0,0
259001190000,FUNPATRI,550000,0,0,0,0
259001200000,FEMA - CRÉDITO DE CARBONO,26461640,0,0,0,0
259001210000,CONSTRUÇÃO BIBLIOTECA DE ITAQUERA/SAVOY,450000,0,0,0,0
259001240000,OPERAÇÃO URBANA ÁGUA ESPRAIADA,575066033,200000,0.03,200003.3,0.03
259001270000,FUNDO ESPECIAL DE DESPESAS DO TCM,1000,0,0,0,0
259001300000,PMSP - SEHAB/GESTÃO DE CRÉDITO - COHAB/HABI,13067024,1306278.23,10,6458758.21,49.43
259001320000,OPERAÇÃO URBANA VILA SONIA,1100000,0,0,0,0
259001330000,OPERAÇÃO URBANA CENTRO,1150000,101362.87,8.81,292025.08,25.39
259001370000,PMSP-FUNCAP-SMC/TAC-PAVILHÃO CULTURAS BRASILEIRAS,1250000,0,0,370000,29.6
259001380000,DIREITOS CREDITÓRIOS - PMSP/COHAB,27587929,3921431.9,14.21,16845730.94,61.06
259001390000,FEMA - COMPENSAÇÕES AMBIENTAIS,30000000,2916951.75,9.72,7758766.43,25.86
259001430000,DEPÓSITO JUDICIAL,50000000,0,0,0,0
900000000000,DEDUÇÕES DA RECEITA CORRENTE,-1772724706,-132553275.3,7.48,-849270604.8,47.91
910000000000,DEDUÇÕES DA RECEITA TRIBUTÁRIA,0,-3187170.5,0,-11581292.71,0
911000000000,DEDUÇÕES DE IMPOSTOS,0,-3158682.53,0,-11489411.62,0
911200000000,DEDUÇÕES DOS IMPOSTOS S/ O PATRIMÔNIO E RENDA,0,-1558032.82,0,-3228525.7,0
911202000000,DEDUÇÕES DO IMPOSTOS S/ A PROPRIEDADE PREDIAL E TERRITORIAL URBANA,0,-1558032.82,0,-2825490.86,0
911202010000,DEDUÇÕES DO IMPOSTO S/ A PROPRIEDADE PREDIAL,0,-1558032.82,0,-2825490.86,0
911204000000,DEDUÇÕES DO IMPOSTO S/ A RENDA E PROVENTOS DE QUALQUER NATUREZA,0,0,0,-24503.2,0
911204310000,DEDUÇÕES DO IMPOSTO DE RENDA RETIDO NAS FONTES S/ OS RENDIMENTOS DO TR,0,0,0,-24503.2,0
911208000000,DEDUÇÕES DO IMPOSTO S/ TRANSMISSÃO INTER-VIVOS DE,0,0,0,-378531.64,0
911208010000,DEDUÇÕES DO IMPOSTO S/ TRANSMISSÃO  INTER-VIVOS  DE BENS IMÓVEIS E DE,0,0,0,-378531.64,0
911300000000,DEDUÇÕES DO IMPOSTO S/ A PRODUÇÃO E A CIRCULAÇÃO,0,-1600649.71,0,-8260885.92,0
911305000000,DEDUÇÕES DO IMPOSTO S/ SERVIÇOS DE QUALQUER NATUREZA,0,-1600649.71,0,-8260885.92,0
911305010000,DEDUÇÕES DO ISS,0,-1600649.71,0,-8260885.92,0
912000000000,DEDUÇÕES DE TAXAS,0,-28487.97,0,-91881.09,0
912100000000,DEDUÇÕES DE TAXAS PELO EXERCÍCIO DO PODER DE POLICIA,0,-28350.12,0,-91555.52,0
912125000000,DEDUÇÕES DE TAXAS DE LICENÇA P/ FUNCIONAMENTO DE ESTABELECIMENTOS COME,0,-23450.02,0,-83162.37,0
912125030000,DEDUÇÕES DA TAXA DE FISCALIZAÇÃO DE ESTABELECIMENTOS - TFE,0,-23450.02,0,-83162.37,0
912126000000,DEDUÇÕES DA TAXA DE PUBLICIDADE COMERCIAL,0,-4900.1,0,-8393.15,0
912126010000,DEDUÇÕES DA TAXA DE FISCALIZAÇÃO DE ANÚNCIOS,0,-4900.1,0,-8393.15,0
912200000000,DEDUÇÕES DE TAXAS PELA PRESTAÇÃO DE SERVIÇOS,0,-137.85,0,-325.57,0
912290000000,DEDUÇÕES DA TAXA DE LIMPEZA PÚBLICA,0,-137.85,0,-325.57,0
912290020000,DEDUÇÕES DA TAXA DE RESÍDUOS SÓLIDOS DOMICILARES - TRSD,0,0,0,-187.72,0
912290030000,DEDUÇÕES DA TAXA DE RESÍDUOS SÓLIDOS DE SERVIÇOS DE SAÚDE - TRSS,0,-137.85,0,-137.85,0
930000000000,DEDUÇÕES DA RECEITA PATRIMONIAL,0,-8635.33,0,-44192.79,0
932000000000,DEDUÇÕES DAS RECEITAS DE VALORES MOBILIARIOS,0,-1470.77,0,-34595.18,0
932900000000,DEDUÇÕES DOS FUNDOS DE INVESTIMENTO,0,-1470.77,0,-34595.18,0
932901000000,DEDUÇÕES DOS FUNDOS DE INVESTIMENTO - RENDA FIXA,0,-1470.77,0,-34595.18,0
932901010000,DEDUÇÕES PMSP,0,-1470.77,0,-34595.18,0
933000000000,DEDUÇÕES DAS RECEITAS DE CONCESSÕES E PERMISSÕES,0,-7164.56,0,-9597.61,0
933900000000,DEDUÇÕES DAS OUTRAS RECEITAS DE CONCESSÕES E PERMISSÕES,0,-7164.56,0,-9597.61,0
933999000000,DEDUÇÕES DAS OUTRAS RECEITAS DE CONCESSÕES E PERMISSÕES,0,-7164.56,0,-9597.61,0
933999020000,"DEDUÇÕES DAS RENDAS DE MERCADOS, FEIRAS E FRIGORIFICOS (ANT.MAT.) - SI",0,-7164.56,0,-9597.61,0
960000000000,DEDUÇÕES DE RECEITAS DE SERVIÇOS,0,-502.4,0,-3209.33,0
960013000000,DEDUÇÕES DE SERVIÇOS ADMINISTRATIVOS,0,-502.4,0,-3151.3,0
960013080000,DEDUÇÕES DE SERVIÇOS DE EXPEDIENTES,0,-116.4,0,-116.4,0
960013130000,DEDUÇÕES DE AUTUAÇÕES DE PROCESSOS - DAMSP,0,0,0,-609.95,0
960013180000,DEDUÇÕES DE SERVIÇOS DE TRANSPORTE DO DTP,0,-386,0,-2424.95,0
960043000000,"DEDUÇÕES DOS SERVIÇOS DE COLETA, TRANSPORTE, TRATAMENTO E DESTINO FINA",0,0,0,-58.03,0
960043010000,DEDUÇÕES DA COLETA DE RESÍDUOS SÓLIDOS - SAÚDE - LIMPURB,0,0,0,-58.03,0
970000000000,DEDUÇÕES DE TRANSFERÊNCIAS CORRENTES,-1772724706,-129265790.18,7.29,-835721107.76,47.14
972000000000,DEDUÇÕES DE TRANSFERÊNCIAS INTERGOVERNAMENTAIS,-1772724706,-129265790.18,7.29,-835721107.76,47.14
972100000000,DEDUÇÕES DE TRANSFERÊNCIAS DA UNIÃO,-46662802,-3942726.87,8.45,-18001805.61,38.58
972101000000,DEDUÇÃO DAS RECEITAS DE TRANSFERÊNCIAS DA UNIÃO,-39627136,-3361299.49,8.48,-15094668.71,38.09
972101020000,DEDUÇÃO DE RECEITA DO FPM - FUNDEB E REDUTOR FINANCEIRO (CORRESP. 1721,-39419304,-3317341.99,8.42,-14966622.93,37.97
972101050000,DEDUÇÃO DE RECEITA PARA A FORMAÇÃO DO FUNDEB - ITR (CORRESP. 1721.01.0,-207832,-43957.5,21.15,-128045.78,61.61
972136000000,DEDUÇÃO DE RECEITA PARA FORMAÇÃO DO FUNDEB - ICMS DESONERAÇÃO - LEI CO,-7035666,-581427.38,8.26,-2907136.9,41.32
972200000000,DEDUÇÕES DE TRANSFERÊNCIAS DO ESTADO,-1726061904,-125323063.31,7.26,-817719302.15,47.37
972201000000,DEDUÇÃO DAS RECEITAS DE TRANSFERÊNCIA DOS ESTADOS,-1726061904,-125323063.31,7.26,-817719302.15,47.37
972201010000,DEDUÇÃO DE RECEITA PARA A FORMAÇÃO DO FUNDEB - ICMS (CORRESP. 1722.01.,-1334497461,-110386367.78,8.27,-497041575.06,37.25
972201020000,DEDUÇÃO DE RECEITA PARA A FORMAÇÃO DO FUNDEB - IPVA (CORRESP. 1722.01.,-380767600,-13925000.83,3.66,-316838200.09,83.21
972201040000,DEDUÇÃO DE RECEITA PARA A FORMAÇÃO DO FUNDEB - IPI - EXPORTAÇÃO (CORRE,-10796843,-1011694.7,9.37,-3839527,35.56
990000000000,DEDUÇÕES DE OUTRAS RECEITAS CORRENTES,0,-91176.89,0,-1920802.21,0
991000000000,DEDUÇÕES DE MULTAS E JUROS DE MORA,0,-89048.39,0,-1859824.82,0
991100000000,DEDUÇÕES DAS MULTAS E JUROS DE MORA DOS TRIBUTOS,0,-0.01,0,-235.08,0
991140000000,DEDUÇÕES DAS MULTAS E JUROS DE MORA DO IMPOSTO S/ SERVIÇOS DE QUALQUER,0,-0.01,0,-0.01,0
991140010000,DEDUÇÕES DAS MULTAS E JUROS DE MORA DO ISS,0,-0.01,0,-0.01,0
991199000000,DEDUÇÕES DE MULTAS E JUROS DE MORA-OUTROS TRIBUTOS,0,0,0,-235.07,0
991199010000,DEDUÇÕES DE MULTAS E JUROS DE MORA-OUTROS TRIBUTOS,0,0,0,-235.07,0
991900000000,DEDUÇÕES DE MULTAS DE OUTRAS ORIGENS,0,-89048.38,0,-1859589.74,0
991915000000,DEDUÇÕES DE MULTAS PREVISTAS NA LEGISLAÇÃO DE TRÂNSITO,0,-31101.21,0,-500138.13,0
991915010000,DEDUÇÕES DE MULTAS DE TRÂNSITO - DSV,0,-31101.21,0,-498665.46,0
991915040000,DEDUÇÕES DAS MULTAS TRÂNS VEÍC OUTR EST - RENAINF,0,0,0,-1472.67,0
991927000000,DEDUÇÕES DAS MULTAS E JUROS PREVISTOS EM CONTRATOS,0,-57947.17,0,-1359451.61,0
991927020000,DEDUÇÕES DAS MULTAS E JUROS/CONTRATOS PMSP,0,-57947.17,0,-1359451.61,0
993000000000,DEDUÇÕES DA RECEITA DA DÍVIDA ATIVA,0,0,0,-1245.45,0
993100000000,DEDUÇÕES DA RECEITA DA DÍVIDA ATIVA TRIBUTÁRIA,0,0,0,-853.68,0
993199000000,DEDUÇÕES DA RECEITA DA DÍVIDA ATIVA DE OUTROS TRIBUTOS,0,0,0,-853.68,0
993199010000,DEDUÇÕES DA RECEITA DA DÍVIDA ATIVA DE OUTROS TRIBUTOS - PRINCIPAL - P,0,0,0,-853.68,0
993200000000,DEDUÇÕES DA RECEITA DA DÍVIDA ATIVA NÂO TRIBUTÁRIA,0,0,0,-391.77,0
993299000000,DEDUÇÕES DA RECEITA DA DÍVIDA ATIVA  NÂO TRIBUTÁRIA DE OUTRAS RECEITAS,0,0,0,-391.77,0
993299060000,DEDUÇÕES DA RECEITA DA DÍVIDA ATIVA NÃO TRIBUTÁRIA DE OUTRAS RECEITAS,0,0,0,-391.77,0
999000000000,DEDUÇÕES DAS RECEITAS DIVERSAS,0,-2128.5,0,-59731.94,0
999001000000,DEDUÇÕES DE RECEITA DO PROGRAMA DE RECUPERAÇÃO FISCAL E DO PARCELAMENT,0,0,0,-625.92,0
999001020000,DEDUÇÕES DO PROGRAMA DE PARCELAMENTO INCENTIVADO - PPI,0,0,0,-625.92,0
999002000000,DEDUÇÕES DA RECEITA DE ÔNUS DE SUCUMBÊNCIA DE AÇÕES JUDICIAIS,0,0,0,-79.93,0
999002010000,DEDUÇÕES DA RECEITA DE HONORÁRIOS DE ADVOGADOS,0,0,0,-79.93,0
999099000000,DEDUÇÕES DE OUTRAS RECEITAS,0,-2128.5,0,-59026.09,0
999099220000,DEDUÇÕES DE EVENTUAIS DIVERSOS - PMSP,0,-2128.5,0,-59026.09,0
